{
  "schemaVersion": "chatgpt.browser_control.operation_collect_request.v1",
  "handle": {
    "schemaVersion": "chatgpt.browser_control.operation_handle.v1",
    "operationId": "11111111-1111-4111-8111-111111111111",
    "requestDigest": "hmac-sha256:aaaaaaaaaaaaaaaaaaaaaaaaaaaaaaaaaaaaaaaaaaaaaaaaaaaaaaaaaaaaaaaa",
    "surface": "chat",
    "revision": 8,
    "phase": "generating",
    "mutationBoundary": "send_may_have_occurred",
    "targetBindingDigest": "hmac-sha256:bbbbbbbbbbbbbbbbbbbbbbbbbbbbbbbbbbbbbbbbbbbbbbbbbbbbbbbbbbbbbbbb"
  },
  "wait": false,
  "timeoutMs": 5000,
  "pollIntervalMs": 250,
  "responseContent": "metadata"
}
